{
  "record_kind": "implement_m5_ai_action_state_banners_and_boundary_blocked_banners_across_claimed_m5_inline_panel_review_agent_surfaces",
  "schema_version": 1,
  "packet_id": "m5-ai-action-state-banner-primitive:branch-worktree-agent-preview:0001",
  "matrix_label": "M5 AI action-state banner and boundary-blocked-banner primitive: execution mode, action state, scope reach, placement, approval posture, operator controls, and boundary-blocked safe alternatives",
  "banner_rows": [
    {
      "consumer_surface": "inline_explain_fix",
      "qualification": "stable",
      "owner_role": "Inline explain/fix owner",
      "scope_summary": "The inline explain/fix overlay renders the shared banner so a foreground-assistant explanation reads as active-within-scope with open-plan / pause / cancel controls, while a guided-patch fix that would write beyond the reviewed file scope reads as boundary-blocked with a banner naming the reviewed-file-scope boundary and a narrow-to-reviewed-scope safe next action rather than a generic model error",
      "surface_families": [
        "assistant_panel",
        "patch_review",
        "branch_agent_console",
        "connector_admin",
        "model_manager",
        "run_history",
        "replay_review",
        "support_desk"
      ],
      "deployment_lines": [
        "local_oss",
        "self_hosted",
        "managed",
        "air_gapped",
        "mirror_offline"
      ],
      "anatomy_parts": [
        "execution_mode_badge",
        "scope_reach_cue",
        "placement_cue",
        "approval_posture_cue",
        "action_state_cue",
        "operator_controls",
        "boundary_blocked_banner",
        "next_safe_action_cue"
      ],
      "execution_modes": [
        "foreground_assistant",
        "guided_patch",
        "background_branch_agent",
        "review_first_placement",
        "headless_automation"
      ],
      "action_states": [
        "idle",
        "composing",
        "streaming",
        "tool_running",
        "awaiting_approval",
        "paused",
        "boundary_blocked",
        "completed",
        "failed"
      ],
      "scope_reaches": [
        "single_selection",
        "current_file",
        "reviewed_file_set",
        "workspace_scoped",
        "connector_scoped",
        "cross_workspace_scoped"
      ],
      "placements": [
        "inline_overlay",
        "assistant_side_panel",
        "review_lane",
        "background_branch_worktree",
        "tool_run_timeline"
      ],
      "approval_gates": [
        "auto_approved",
        "notify_only",
        "one_click_confirm",
        "high_friction_typed",
        "two_person_review",
        "policy_blocked"
      ],
      "banner_postures": [
        "active_within_scope",
        "active_awaiting_approval",
        "paused_mid_run",
        "boundary_blocked",
        "completed_clear",
        "failed_needs_attention",
        "idle_ready"
      ],
      "blocked_boundaries": [
        "reviewed_file_scope",
        "connector_boundary",
        "policy_fence",
        "credential_boundary",
        "network_egress_fence",
        "cross_workspace_scope"
      ],
      "safe_alternatives": [
        "narrow_to_reviewed_scope",
        "request_connector_approval",
        "request_scoped_credential",
        "split_into_approved_steps",
        "stay_within_current_workspace",
        "run_read_only_preview"
      ],
      "operator_controls": [
        "open_plan",
        "pause",
        "cancel",
        "resume",
        "take_over",
        "narrow_scope"
      ],
      "export_fields": [
        "execution_mode",
        "action_state",
        "scope_reach",
        "placement",
        "approval_gate",
        "banner_posture",
        "blocked_boundary",
        "safe_alternative",
        "operator_controls",
        "banner_label"
      ],
      "accessibility_routes": [
        "keyboard_focusable",
        "screen_reader_announced",
        "non_hover_reachable",
        "pointer_optional",
        "high_contrast_safe",
        "support_exportable"
      ],
      "consumer_surfaces": [
        "assistant_panel_ui",
        "patch_review_ui",
        "branch_agent_console_ui",
        "cli_inspect",
        "support_export",
        "product_ui"
      ],
      "downgrade_triggers": [
        "execution_mode_unstated",
        "approval_gate_hidden",
        "takeover_path_hidden",
        "proof_stale"
      ],
      "required_proof_packet_refs": [
        "evidence:m5-ai-banner-inline:001"
      ],
      "source_contract_refs": [
        "schemas/ai/m5-ai-action-state-banner.schema.json",
        "schemas/ai/tool_call_timeline_entry.schema.json",
        "schemas/ai/branch_agent_session.schema.json"
      ],
      "example_resolutions": [
        {
          "input": {
            "banner_label": "inline explain selection",
            "scope_repr": "single selection: lines 40-52",
            "execution_mode": "foreground_assistant",
            "action_state": "streaming",
            "scope_reach": "single_selection",
            "placement": "inline_overlay",
            "approval_gate": "auto_approved",
            "blocked_boundary": null,
            "operator_controls": [
              "open_plan",
              "pause",
              "cancel"
            ]
          },
          "resolved": {
            "banner_label": "inline explain selection",
            "scope_repr": "single selection: lines 40-52",
            "execution_mode": "foreground_assistant",
            "action_state": "streaming",
            "scope_reach": "single_selection",
            "placement": "inline_overlay",
            "approval_gate": "auto_approved",
            "blocked_boundary": null,
            "operator_controls": [
              "open_plan",
              "pause",
              "cancel"
            ],
            "banner_posture": "active_within_scope",
            "is_active": true,
            "is_boundary_blocked": false,
            "needs_operator_attention": false,
            "boundary_banner": null
          }
        },
        {
          "input": {
            "banner_label": "inline fix apply",
            "scope_repr": "reviewed set: 3 files",
            "execution_mode": "guided_patch",
            "action_state": "boundary_blocked",
            "scope_reach": "current_file",
            "placement": "inline_overlay",
            "approval_gate": "one_click_confirm",
            "blocked_boundary": "reviewed_file_scope",
            "operator_controls": [
              "narrow_scope",
              "cancel"
            ]
          },
          "resolved": {
            "banner_label": "inline fix apply",
            "scope_repr": "reviewed set: 3 files",
            "execution_mode": "guided_patch",
            "action_state": "boundary_blocked",
            "scope_reach": "current_file",
            "placement": "inline_overlay",
            "approval_gate": "one_click_confirm",
            "blocked_boundary": "reviewed_file_scope",
            "operator_controls": [
              "narrow_scope",
              "cancel"
            ],
            "banner_posture": "boundary_blocked",
            "is_active": false,
            "is_boundary_blocked": true,
            "needs_operator_attention": true,
            "boundary_banner": {
              "blocked_boundary": "reviewed_file_scope",
              "safe_alternative": "narrow_to_reviewed_scope",
              "scope_reach": "current_file",
              "placement": "inline_overlay",
              "headline": "AI blocked at the reviewed file scope: request would exceed current_file reach; safe next: narrow the request to the reviewed file scope"
            }
          }
        }
      ],
      "masks_execution_mode_or_reach": false,
      "shows_boundary_crossing_as_allowed": false,
      "emits_generic_model_or_tool_error": false,
      "hides_operator_controls_or_takeover": false
    },
    {
      "consumer_surface": "assistant_panel",
      "qualification": "stable",
      "owner_role": "Assistant-panel owner",
      "scope_summary": "The assistant panel renders the shared banner so a foreground-assistant workspace edit behind a high-friction typed confirmation reads as active-awaiting-approval, while a paused mid-run edit reads as paused with resume / cancel controls — the mode, reach, and approval visible without a secondary inspector",
      "surface_families": [
        "assistant_panel",
        "patch_review",
        "branch_agent_console",
        "connector_admin",
        "model_manager",
        "run_history",
        "replay_review",
        "support_desk"
      ],
      "deployment_lines": [
        "local_oss",
        "self_hosted",
        "managed",
        "air_gapped",
        "mirror_offline"
      ],
      "anatomy_parts": [
        "execution_mode_badge",
        "scope_reach_cue",
        "placement_cue",
        "approval_posture_cue",
        "action_state_cue",
        "operator_controls",
        "boundary_blocked_banner",
        "next_safe_action_cue"
      ],
      "execution_modes": [
        "foreground_assistant",
        "guided_patch",
        "background_branch_agent",
        "review_first_placement",
        "headless_automation"
      ],
      "action_states": [
        "idle",
        "composing",
        "streaming",
        "tool_running",
        "awaiting_approval",
        "paused",
        "boundary_blocked",
        "completed",
        "failed"
      ],
      "scope_reaches": [
        "single_selection",
        "current_file",
        "reviewed_file_set",
        "workspace_scoped",
        "connector_scoped",
        "cross_workspace_scoped"
      ],
      "placements": [
        "inline_overlay",
        "assistant_side_panel",
        "review_lane",
        "background_branch_worktree",
        "tool_run_timeline"
      ],
      "approval_gates": [
        "auto_approved",
        "notify_only",